{
  "schemaVersion": "1.0.0",
  "id": "scholarly-pdf-extraction-strata-2026-08-v1",
  "privacy": "repository-fixture-identities-source-reviewed-no-private-inputs",
  "protocol": {
    "command": "npm run pdf:benchmark:extraction",
    "reportPrivacy": "identities-hashes-counts-diagnostic-codes-only",
    "sourceLabelPolicy": "source-review-required-parser-output-never-a-label",
    "regexProxyPolicy": "authoritative-pipeline-counters-only-regex-never-gates",
    "abstentionPolicy": {
      "score": 0.25,
      "beatsDegenerateAnswer": true,
      "status": "reported-not-correct"
    },
    "corpusBalance": {
      "layouts": ["one-column", "two-column"],
      "minimumDocumentsPerLayout": 2,
      "reportByLayout": true
    }
  },
  "documents": [
    {
      "id": "pdf-to-epub-fidelity",
      "fixturePath": "tests/fixtures/pdf/pdf-to-epub-fidelity.pdf",
      "sha256": "17921375594e87b1377e86d304f9f151c393255eb94b8e0f523179f6b9e07cea",
      "byteLength": 16759,
      "pageCount": 3,
      "layout": "one-column",
      "groundTruthReview": {
        "kind": "source-reviewed",
        "derivedFrom": "source-document",
        "reviewStatus": "review-required",
        "reviewers": [],
        "parserOutputConsulted": false,
        "reviewEvidence": null
      }
    },
    {
      "id": "structured-scientific",
      "fixturePath": "tests/fixtures/pdf/structured-scientific.pdf",
      "sha256": "7a75163906224b0dbf78e28975f6e16ec0e3b7485532995f9a1226b3f1928500",
      "byteLength": 6075,
      "pageCount": 1,
      "layout": "two-column",
      "groundTruthReview": {
        "kind": "source-reviewed",
        "derivedFrom": "source-document",
        "reviewStatus": "review-required",
        "reviewers": [],
        "parserOutputConsulted": false,
        "reviewEvidence": null
      }
    },
    {
      "id": "multilingual-scan",
      "fixturePath": "tests/fixtures/pdf/multilingual-scan.pdf",
      "sha256": "514195c541dcf6aa28b5d41a439ac623ccaf9cca2f452e9b4c49411e1c559aec",
      "byteLength": 6580,
      "pageCount": 1,
      "layout": "one-column",
      "groundTruthReview": {
        "kind": "source-reviewed",
        "derivedFrom": "source-document",
        "reviewStatus": "review-required",
        "reviewers": [],
        "parserOutputConsulted": false,
        "reviewEvidence": null
      }
    },
    {
      "id": "diagnostic-overlays",
      "fixturePath": "tests/fixtures/pdf/diagnostic-overlays.pdf",
      "sha256": "bdafe1056d6b47d9b59dddcf4585c42c42851e9cd32cecbd912087117b7c2633",
      "byteLength": 1238,
      "pageCount": 1,
      "layout": "two-column",
      "groundTruthReview": {
        "kind": "source-reviewed",
        "derivedFrom": "source-document",
        "reviewStatus": "review-required",
        "reviewers": [],
        "parserOutputConsulted": false,
        "reviewEvidence": null
      }
    }
  ],
  "strata": [
    {
      "id": "table-structure",
      "task": "table-structure",
      "description": "Recover bounded rows, columns, header scope, spans, and source cell text.",
      "groundTruth": {
        "kind": "source-reviewed",
        "derivedFrom": "source-document",
        "reviewStatus": "review-required",
        "reviewers": [],
        "parserOutputConsulted": false,
        "reviewEvidence": null
      },
      "metric": {
        "id": "table-structure-f1",
        "name": "table topology and cell F1",
        "unit": "table-and-cell-f1",
        "formula": "mean(exact-header-scope-and-topology × cell-text-F1) per reviewed table",
        "scoreRange": [0, 1],
        "abstentionScore": 0.25,
        "degenerateScore": 0,
        "degenerateAnswerGuardId": "table-structure-degenerate-answer-guard",
        "authoritativeEvidence": "source-reviewed rows, columns, header scope, spans, cell text, geometry, and line lineage"
      },
      "degenerateAnswerGuard": {
        "id": "table-structure-degenerate-answer-guard",
        "rejects": [
          "empty-or-missing-table-output",
          "page-wide-grid-that-covers-the-body-measure",
          "one-grid-fused-across-multiple-reviewed-tables"
        ],
        "detection": "A guarded table output scores zero; an explicit abstention scores 0.25.",
        "score": 0,
        "abstentionScore": 0.25,
        "failClosed": true
      }
    },
    {
      "id": "heading-structure",
      "task": "heading-structure",
      "description": "Recover the ordered heading sequence and level, including unnumbered and non-English headings.",
      "groundTruth": {
        "kind": "source-reviewed",
        "derivedFrom": "source-document",
        "reviewStatus": "review-required",
        "reviewers": [],
        "parserOutputConsulted": false,
        "reviewEvidence": null
      },
      "metric": {
        "id": "heading-sequence-f1",
        "name": "heading sequence and level F1",
        "unit": "ordered-heading-f1",
        "formula": "F1 over exact (heading text, level) decisions with sequence preserved",
        "scoreRange": [0, 1],
        "abstentionScore": 0.25,
        "degenerateScore": 0,
        "degenerateAnswerGuardId": "heading-structure-degenerate-answer-guard",
        "authoritativeEvidence": "source-reviewed heading sequence, level, numbering flag, and language"
      },
      "degenerateAnswerGuard": {
        "id": "heading-structure-degenerate-answer-guard",
        "rejects": [
          "empty-or-missing-heading-output",
          "every-line-as-a-heading",
          "heading-count-more-than-two-times-reviewed-sequence"
        ],
        "detection": "A broad heading flood scores zero; an explicit abstention scores 0.25.",
        "score": 0,
        "abstentionScore": 0.25,
        "failClosed": true
      }
    },
    {
      "id": "display-equation",
      "task": "display-equation",
      "description": "Recover display-equation grouping and visible equation ownership as bounded objects.",
      "groundTruth": {
        "kind": "source-reviewed",
        "derivedFrom": "source-document",
        "reviewStatus": "review-required",
        "reviewers": [],
        "parserOutputConsulted": false,
        "reviewEvidence": null
      },
      "metric": {
        "id": "display-equation-object-f1",
        "name": "display-equation object F1",
        "unit": "bounded-equation-object-f1",
        "formula": "F1 over source-page equation objects after grouping and label ownership",
        "scoreRange": [0, 1],
        "abstentionScore": 0.25,
        "degenerateScore": 0,
        "degenerateAnswerGuardId": "display-equation-degenerate-answer-guard",
        "authoritativeEvidence": "source glyph/raster bounds and reviewed visible equation labels"
      },
      "degenerateAnswerGuard": {
        "id": "display-equation-degenerate-answer-guard",
        "rejects": [
          "empty-or-missing-equation-output",
          "page-wide-equation-box",
          "each-body-line-emitted-as-an-equation"
        ],
        "detection": "Unbounded or absent equation objects score zero; an explicit abstention scores 0.25.",
        "score": 0,
        "abstentionScore": 0.25,
        "failClosed": true
      }
    },
    {
      "id": "figure-diagram",
      "task": "figure-diagram",
      "description": "Recover bounded figure/diagram assets and retain their caption relationship.",
      "groundTruth": {
        "kind": "source-reviewed",
        "derivedFrom": "source-document",
        "reviewStatus": "review-required",
        "reviewers": [],
        "parserOutputConsulted": false,
        "reviewEvidence": null
      },
      "metric": {
        "id": "figure-diagram-object-f1",
        "name": "figure and diagram object F1",
        "unit": "bounded-visual-object-f1",
        "formula": "F1 over bounded source objects with a caption-of relationship",
        "scoreRange": [0, 1],
        "abstentionScore": 0.25,
        "degenerateScore": 0,
        "degenerateAnswerGuardId": "figure-diagram-degenerate-answer-guard",
        "authoritativeEvidence": "source raster/component bounds and reviewed caption ownership"
      },
      "degenerateAnswerGuard": {
        "id": "figure-diagram-degenerate-answer-guard",
        "rejects": [
          "empty-or-missing-visual-output",
          "page-wide-asset-fused-with-neighbouring-content",
          "caption-without-a-bounded-asset"
        ],
        "detection": "A dropped or unbounded visual scores zero; an explicit abstention scores 0.25.",
        "score": 0,
        "abstentionScore": 0.25,
        "failClosed": true
      }
    },
    {
      "id": "prose-continuity",
      "task": "prose-continuity",
      "description": "Measure continuous prose with the pipeline's authoritative line-boundary counters.",
      "groundTruth": {
        "kind": "source-reviewed",
        "derivedFrom": "source-document",
        "reviewStatus": "review-required",
        "reviewers": [],
        "parserOutputConsulted": false,
        "reviewEvidence": null
      },
      "metric": {
        "id": "prose-authoritative-continuity",
        "name": "authoritative prose continuity",
        "unit": "counter-derived-continuity",
        "formula": "max(0, 1 - unresolvedCorruptingJoinCount / max(1, lineBoundaryCount))",
        "scoreRange": [0, 1],
        "abstentionScore": 0.25,
        "degenerateScore": 0,
        "degenerateAnswerGuardId": "prose-continuity-degenerate-answer-guard",
        "authoritativeEvidence": "unresolvedCorruptingJoinCount and line-boundary decision ledger"
      },
      "degenerateAnswerGuard": {
        "id": "prose-continuity-degenerate-answer-guard",
        "rejects": [
          "missing-authoritative-counters",
          "regex-only-hyphenation-proxy",
          "line-boundary-counter-arithmetic-inconsistency"
        ],
        "detection": "Regex-only or inconsistent evidence scores zero; an explicit abstention scores 0.25.",
        "score": 0,
        "abstentionScore": 0.25,
        "failClosed": true
      }
    },
    {